front,back
The each method returns the original array,TRUE
map returns an original array,FALSE it returns a new array composed of the block result
The any? method returns a boolean,TRUE
The chunk method returns an enumerator,TRUE
The partition method returns an array,FALSE it returns 2 arrays one that meets the code block conditions and one containing the balance
The reduce method returns an object,TRUE
slice_when returns and array,FALSE it returns and enumerator
each_cons returns nil,TRUE if block passed else ruturns enumerator
